{
  "$schema": "http://json-schema.org/draft-07/schema#",
  "type": "object",
  "properties": {
    "id": {
      "type": "string"
    },
    "created_at": {
      "type": "string",
      "format": "date-time"
    },
    "created_at_timestamp": {
      "type": "integer",
      "description": "A UNIX timestamp in seconds that represents the same date as `created_at`."
    },
    "updated_at": {
      "type": "string",
      "format": "date-time"
    },
    "updated_at_timestamp": {
      "type": "integer",
      "description": "A UNIX timestamp in seconds that represents the same date as `updated_at`."
    },
    "word": {
      "type": "string",
      "description": "A word or expression in Arabic."
    },
    "definition": {
      "type": "string",
      "description": "The definition of the word in Arabic."
    },
    "translation": {
      "type": "string",
      "description": "The English translation of the word."
    },
    "type": {
      "type": "string",
      "description": "The type of the word.",
      "enum": ["ism", "fi'l", "harf", "expression"]
    },
    "root": {
      "type": "array",
      "description": "An array of letters representing the root letters of the word.",
      "items": {
        "type": "string"
      }
    },
    "tags": {
      "type": "array",
      "description": "Any tags associated with the word. These can denote things like the context.",
      "items": {
        "type": "string"
      }
    },
    "antonyms": {
      "type": "array",
      "description": "Any antonyms of the word.",
      "items": {
        "type": "object",
        "properties": {
          "word": {
            "type": "string"
          }
        }
      }
    },
    "examples": {
      "type": "array",
      "description": "Examples using the word.",
      "items": {
        "type": "object",
        "properties": {
          "sentence": {
            "description": "A sentence using the word.",
            "type": "string"
          },
          "context": {
            "description": "The context of the sentence. This can refer to casual or formal contexts, for example.",
            "type": "string"
          },
          "translation": {
            "description": "The English translation of the sentence.",
            "type": "string"
          }
        },
        "required": ["sentence"]
      }
    },
    "morphology": {
      "type": "object",
      "description": "The morphological properties of the word.",
      "properties": {
        "ism": {
          "type": "object",
          "description": "The morphological properties of an ism such as the gender and the different plural and singular forms.",
          "properties": {
            "singular": {
              "type": "string"
            },
            "dual": {
              "type": "string"
            },
            "plurals": {
              "type": "array",
              "description": "The (broken) plural forms of the word. Use harakat to indicate inflection.",
              "items": {
                "type": "object",
                "properties": {
                  "word": {
                    "type": "string"
                  },
                  "details": {
                    "type": "string",
                    "description": "Any additional details about this form such as frequency of usage or context."
                  }
                },
                "required": ["word"]
              }
            },
            "gender": {
              "type": "string",
              "enum": ["masculine", "feminine"]
            },
            "inflection": {
              "type": "string",
              "description": "The inflection of the word. This refers to how many case endings the word can take. Three means it can take all three, two means it can only take raf' and nasb, and one means it is indeclinable.",
              "enum": ["indeclinable", "diptote", "triptote"]
            }
          }
        },
        "verb": {
          "type": "object",
          "description": "The morphological properties of a fi'l such as the verb conjugations and noun forms.",
          "properties": {
            "huroof": {
              "type": "array",
              "description": "A list of the prepositions that can be used with the fi'l. Typically, if the meaning with the preposition is completely different, then it's better to create a separate dictionary entry.",
              "items": {
                "type": "object",
                "properties": {
                  "harf": {
                    "type": "string"
                  },
                  "meaning": {
                    "type": "string",
                    "description": "The meaning of the fi'l when used with the preposition. If it is the same as the base meaning, then leave this blank."
                  }
                },
                "required": ["harf"]
              }
            },
            "past_tense": {
              "type": "string"
            },
            "present_tense": {
              "type": "string"
            },
            "active_participle": {
              "type": "string"
            },
            "passive_participle": {
              "type": "string"
            },
            "imperative": {
              "type": "string"
            },
            "masadir": {
              "type": "array",
              "description": "A list of the possible verbal noun forms.",
              "items": {
                "type": "object",
                "properties": {
                  "word": {
                    "type": "string"
                  },
                  "details": {
                    "type": "string",
                    "description": "Any additional details about this form such as frequency of usage or context."
                  }
                },
                "required": ["word"]
              }
            },
            "form": {
              "type": "string",
              "description": "The form or pattern of the verb from I - X."
            },
            "form_arabic": {
              "type": "string",
              "description": "The form or pattern of the verb in Arabic using the root ف-ع-ل."
            }
          }
        }
      }
    },
    "flashcard": {
      "$ref": "flashcard.json"
    },
    "flashcard_reverse": {
      "$ref": "flashcard.json"
    }
  },
  "required": ["id", "word", "translation"]
}
