[
  {
    "id": "N3WMRETxCG0v84LOv09Yq",
    "word": "مِمحاَة",
    "translation": "eraser",
    "definition": "",
    "type": "ism",
    "root": [],
    "tags": ["معهد الخليل", "قصص النبيين"],
    "antonyms": [],
    "examples": [],
    "morphology": {
      "ism": {
        "singular": "",
        "dual": "",
        "plurals": [],
        "gender": "masculine",
        "inflection": "triptote"
      }
    }
  },
  {
    "id": "bbaGH3bQym70S-wxEJM7p",
    "word": "عِمارة",
    "translation": "art of building",
    "definition": "",
    "type": "ism",
    "root": ["ع", "م", "ر"],
    "tags": ["معهد الخليل", "قصص النبيين"],
    "antonyms": [],
    "examples": [],
    "morphology": {
      "ism": {
        "singular": "",
        "dual": "",
        "plurals": [],
        "gender": "masculine",
        "inflection": "triptote"
      }
    }
  },
  {
    "id": "e_kin_ZSPgJGQLpPAMgsB",
    "word": "رُزّ",
    "translation": "rice",
    "definition": "",
    "type": "ism",
    "root": [],
    "examples": [],
    "morphology": {
      "ism": {
        "singular": "",
        "dual": "",
        "plurals": [],
        "gender": "masculine",
        "inflection": "triptote"
      }
    }
  },
  {
    "id": "3U--cmjLNVMjM2VkTmB-d",
    "word": "حقيبة",
    "translation": "bag",
    "definition": "",
    "type": "ism",
    "root": [],
    "examples": [],
    "morphology": {
      "ism": {
        "singular": "",
        "dual": "",
        "plurals": [
          {
            "word": "حقائب"
          }
        ],
        "gender": "masculine",
        "inflection": "triptote"
      }
    }
  },
  {
    "id": "XAApYaKaEEHZ99YCrDRO4",
    "word": "أَسَد",
    "translation": "lion",
    "definition": "",
    "type": "ism",
    "root": [],
    "tags": [],
    "antonyms": [],
    "examples": [],
    "morphology": {
      "ism": {
        "singular": "",
        "dual": "",
        "plurals": [
          {
            "word": "أُسُد"
          }
        ],
        "gender": "masculine",
        "inflection": "triptote"
      }
    }
  },
  {
    "id": "55hDJ6ycFxlAvs6sIoWUm",
    "word": "اعتنى بـ",
    "translation": "to give attention to",
    "definition": "اهتمّ بـ",
    "type": "fi'l",
    "root": ["ع", "ن", "ي"],
    "examples": [],
    "morphology": {
      "verb": {
        "huroof": [],
        "past_tense": "",
        "present_tense": "",
        "active_participle": "",
        "passive_participle": "",
        "imperative": "",
        "masadir": [],
        "form": "",
        "form_arabic": ""
      }
    }
  },
  {
    "id": "vTPo_bgJodcNbQ_sHXUvB",
    "word": "سَلَطة",
    "translation": "salad",
    "definition": "",
    "type": "ism",
    "root": [],
    "examples": [],
    "morphology": {
      "ism": {
        "singular": "",
        "dual": "",
        "plurals": [],
        "gender": "masculine",
        "inflection": "triptote"
      }
    }
  },
  {
    "id": "a7BEUVKfwdfTMaD-JGoku",
    "word": "مُدَّة",
    "translation": "interval, period of time, duration",
    "definition": "",
    "type": "ism",
    "root": [],
    "examples": [],
    "morphology": {
      "ism": {
        "singular": "",
        "dual": "",
        "plurals": [],
        "gender": "masculine",
        "inflection": "triptote"
      }
    }
  },
  {
    "id": "mNiMleBdMxoDfT4HYoKGU",
    "word": "صِحِّيّ",
    "translation": "healthy",
    "definition": "",
    "type": "ism",
    "root": [],
    "examples": [],
    "morphology": {
      "ism": {
        "singular": "",
        "dual": "",
        "plurals": [],
        "gender": "masculine",
        "inflection": "triptote"
      }
    }
  },
  {
    "id": "QvRsypI0qrF-npTrbH5Xq",
    "word": "استراح",
    "translation": "to relax",
    "definition": "",
    "type": "fi'l",
    "root": ["ر", "و", "ح"],
    "examples": [],
    "morphology": {
      "verb": {
        "huroof": [],
        "past_tense": "",
        "present_tense": "يستريح",
        "active_participle": "",
        "passive_participle": "",
        "imperative": "",
        "masadir": [],
        "form": "",
        "form_arabic": ""
      }
    }
  },
  {
    "id": "YX0G-BtUFAQbnakJKWXIv",
    "word": "لِحيَة",
    "translation": "beard",
    "definition": "",
    "type": "ism",
    "root": [],
    "examples": [],
    "morphology": {
      "ism": {
        "singular": "",
        "dual": "",
        "plurals": [
          {
            "word": "لِحى"
          }
        ],
        "gender": "masculine",
        "inflection": "triptote"
      }
    }
  },
  {
    "id": "EpYBtRrZlq0uRmb9kanx-",
    "word": "لذلك",
    "translation": "so...",
    "definition": "فـ",
    "type": "ism",
    "root": [],
    "examples": [],
    "morphology": {
      "ism": {
        "singular": "",
        "dual": "",
        "plurals": [],
        "gender": "masculine",
        "inflection": "triptote"
      }
    }
  },
  {
    "id": "gbn1cLuTvJDckXrMpOCna",
    "word": "نَظّارة",
    "translation": "glasses",
    "definition": "",
    "type": "ism",
    "root": [],
    "examples": [],
    "morphology": {
      "ism": {
        "singular": "",
        "dual": "",
        "plurals": [],
        "gender": "masculine",
        "inflection": "triptote"
      }
    }
  },
  {
    "id": "EVgDox9hU7WE1_BoIp8up",
    "word": "مُزدَحِم",
    "translation": "crowded",
    "definition": "",
    "type": "ism",
    "root": [],
    "examples": [],
    "morphology": {
      "ism": {
        "singular": "",
        "dual": "",
        "plurals": [],
        "gender": "masculine",
        "inflection": "triptote"
      }
    }
  },
  {
    "id": "MfylAiiaS2RBRu6iSSGZ1",
    "word": "العلَم",
    "translation": "proper name",
    "definition": "اسم الإنسان",
    "type": "ism",
    "root": [],
    "tags": [],
    "antonyms": [],
    "examples": [],
    "morphology": {
      "ism": {
        "singular": "",
        "dual": "",
        "plurals": [],
        "gender": "masculine",
        "inflection": "triptote"
      }
    }
  },
  {
    "id": "XH5UAfJiEBvQGfQUugVw7",
    "word": "مُجتَهِد",
    "translation": "hard-working",
    "definition": "",
    "type": "ism",
    "root": [],
    "examples": [],
    "morphology": {
      "ism": {
        "singular": "",
        "dual": "",
        "plurals": [],
        "gender": "masculine",
        "inflection": "triptote"
      }
    }
  },
  {
    "id": "4O7KKK1TM5G4HJ7IpgdSa",
    "word": "ناقة",
    "translation": "she-camel",
    "definition": "",
    "type": "ism",
    "root": [],
    "tags": ["معهد الخليل", "قصص النبيين"],
    "antonyms": [],
    "examples": [],
    "morphology": {
      "ism": {
        "singular": "",
        "dual": "",
        "plurals": [],
        "gender": "masculine",
        "inflection": "triptote"
      }
    }
  },
  {
    "id": "aBpKcviHiSBC2gVQbKyIB",
    "word": "كَسول",
    "translation": "lazy",
    "definition": "ضد نشيط",
    "type": "ism",
    "root": [],
    "examples": [],
    "morphology": {
      "ism": {
        "singular": "",
        "dual": "",
        "plurals": [],
        "gender": "masculine",
        "inflection": "triptote"
      }
    }
  },
  {
    "id": "5go0_lPqO8f44pAfUqFAr",
    "word": "عاصِفَة",
    "translation": "storm",
    "definition": "",
    "type": "ism",
    "root": [],
    "examples": [],
    "morphology": {
      "ism": {
        "singular": "",
        "dual": "",
        "plurals": [
          {
            "word": "عَواصِف"
          }
        ],
        "gender": "masculine",
        "inflection": "triptote"
      }
    }
  },
  {
    "id": "YbQef1rrfVBnev-iWFd6D",
    "word": "نَشيط",
    "translation": "energetic",
    "definition": "ضد كسول",
    "type": "ism",
    "root": [],
    "examples": [],
    "morphology": {
      "ism": {
        "singular": "",
        "dual": "",
        "plurals": [],
        "gender": "masculine",
        "inflection": "triptote"
      }
    }
  },
  {
    "id": "a5RLSf5ETcdICDry3rx7d",
    "word": "جَمع",
    "translation": "plural",
    "definition": "",
    "type": "ism",
    "root": [],
    "examples": [],
    "morphology": {
      "ism": {
        "singular": "",
        "dual": "",
        "plurals": [],
        "gender": "masculine",
        "inflection": "triptote"
      }
    }
  },
  {
    "id": "d1YpGKq0EZx43AVPgvxLW",
    "word": "مثنّى",
    "translation": "dual",
    "definition": "",
    "type": "ism",
    "root": [],
    "examples": [],
    "morphology": {
      "ism": {
        "singular": "",
        "dual": "",
        "plurals": [],
        "gender": "masculine",
        "inflection": "triptote"
      }
    }
  },
  {
    "id": "kNsgLQwRsjdfcOCdEAsln",
    "word": "مذكَّر",
    "translation": "masculine",
    "definition": "",
    "type": "ism",
    "root": [],
    "examples": [],
    "morphology": {
      "ism": {
        "singular": "",
        "dual": "",
        "plurals": [],
        "gender": "masculine",
        "inflection": "triptote"
      }
    }
  },
  {
    "id": "R_TjbHo2TZXnsPx7wqIMr",
    "word": "مؤنّث",
    "translation": "feminine",
    "definition": "",
    "type": "ism",
    "root": [],
    "examples": [],
    "morphology": {
      "ism": {
        "singular": "",
        "dual": "",
        "plurals": [],
        "gender": "masculine",
        "inflection": "triptote"
      }
    }
  },
  {
    "id": "NDwY8ZJrkxe5p-rnsQwIT",
    "word": "سَفينَة",
    "translation": "ship",
    "definition": "",
    "type": "ism",
    "root": [],
    "examples": [],
    "morphology": {
      "ism": {
        "singular": "",
        "dual": "",
        "plurals": [
          {
            "word": "سُفُن",
            "details": ""
          }
        ],
        "gender": "masculine",
        "inflection": "triptote"
      }
    }
  },
  {
    "id": "Z-xlNKvqz8wtM9PJscm0Y",
    "word": "حِوار",
    "translation": "conversation",
    "definition": "محادثة",
    "type": "ism",
    "root": [],
    "examples": [],
    "morphology": {
      "ism": {
        "singular": "",